USI	GNPSLibraryAccession	Cosine	Matching Peaks	CompoundName	Adduct	Charge
mzspec:GNPS:GNPS-LIBRARY:accession:CCMSLIB00009995052	CCMSLIB00009995052	0.85	6	Suspect related to Spectral Match to Linolenic acid ethyl ester from NIST14 (predicted molecular formula: C18H28O3) with delta m/z -14.052 (putative explanation: Lys->Asn substitution; atomic difference: -2C,-6H,1O)	[M+H]+	1
mzspec:GNPS:GNPS-LIBRARY:accession:CCMSLIB00009946913	CCMSLIB00009946913	0.84	5	Suspect related to Eicosapentaenoic acid ethyl ester (predicted molecular formula: C18H28O3) with delta m/z -38.053 (putative explanation: unspecified; atomic difference: unspecified)	[M+H]+	1
mzspec:GNPS:GNPS-LIBRARY:accession:CCMSLIB00009988599	CCMSLIB00009988599	0.83	7	Suspect related to Spectral Match to 13S-Hydroxy-9Z,11E,15Z-octadecatrienoic acid from NIST14 (predicted molecular formula: C18H30O4) with delta m/z 15.995 (putative explanation: Ala->Ser substitution|Oxidation or Hydroxylation|Phe->Tyr substitution; atomic difference: 1O|1O|1O)	[M-H2O+H]+	1
mzspec:GNPS:GNPS-LIBRARY:accession:CCMSLIB00009988432	CCMSLIB00009988432	0.77	6	Suspect related to Spectral Match to 13-Keto-9Z,11E-octadecadienoic acid from NIST14 (predicted molecular formula: C18H28O3) with delta m/z -2.016 (putative explanation: 2-amino-3-oxo-butanoic_acid|Intact disulfide bridge|Val->Pro substitution; atomic difference: -2H|-2H|-2H)	[M+H]+	1
mzspec:GNPS:GNPS-LIBRARY:accession:CCMSLIB00009989991	CCMSLIB00009989991	0.76	7	Suspect related to Spectral Match to 9-Oxo-10E,12Z-octadecadienoic acid from NIST14 (predicted molecular formula: C17H24O4) with delta m/z -2.052 (putative explanation: unspecified; atomic difference: unspecified)	[M+H]+	1
mzspec:GNPS:GNPS-LIBRARY:accession:CCMSLIB00009931497	CCMSLIB00009931497	0.74	6	Suspect related to 12S-Hydroxy-5Z,8E,10E-heptadecatrienoic acid (predicted molecular formula: C18H30O4) with delta m/z 30.011 (putative explanation: Ala->Thr substitution|Gly->Ser substitution|desmethylation + reduction of sulfoxide|formaldehyde induced modifications|hydroxymethyl; atomic difference: 1C,2H,1O|1C,2H,1O|1C,2H,1O|1C,2H,1O|1C,2H,1O)	[M-H2O+H]+	1
mzspec:GNPS:GNPS-LIBRARY:accession:CCMSLIB00009949211	CCMSLIB00009949211	0.73	6	Suspect related to Hexadecanedioic acid (predicted molecular formula: C18H32O5) with delta m/z 42.01 (putative explanation: Acetylation|Ser->Glu substitution|unspecified; atomic difference: 2C,2H,1O|2C,2H,1O|3N)	[M-2H2O+H]+	1
