USI	GNPSLibraryAccession	Cosine	Matching Peaks	CompoundName	Adduct	Charge
mzspec:GNPS:GNPS-LIBRARY:accession:CCMSLIB00009992259	CCMSLIB00009992259	0.99	6	Suspect related to Spectral Match to Decaethylene glycol from NIST14 (predicted molecular formula: unknown) with delta m/z -132.079 (putative explanation: PEG repeat unit x3 (reverse); atomic difference: -6C,-12H,-3O)	[M+H]+	1
mzspec:GNPS:GNPS-LIBRARY:accession:CCMSLIB00009999370	CCMSLIB00009999370	0.99	5	Suspect related to Spectral Match to Undecaethylene glycol from NIST14 (predicted molecular formula: unknown) with delta m/z -176.106 (putative explanation: PEG repeat unit x4 (reverse); atomic difference: -8C,-16H,-4O)	[M+H]+	1
mzspec:GNPS:GNPS-LIBRARY:accession:CCMSLIB00009996932	CCMSLIB00009996932	0.98	6	Suspect related to Spectral Match to Nonaethylene glycol from NIST14 (predicted molecular formula: unknown) with delta m/z -88.053 (putative explanation: PEG repeat unit x2 (reverse); atomic difference: -4C,-8H,-2O)	[M+H]+	1
mzspec:GNPS:GNPS-LIBRARY:accession:CCMSLIB00009993776	CCMSLIB00009993776	0.95	5	Suspect related to Spectral Match to Hexaethylene glycol from NIST14 (predicted molecular formula: C14H30O8) with delta m/z 44.026 (putative explanation: Ethanolation|Gly->Thr substitution|PEG repeat unit|unspecified; atomic difference: 2C,4H,1O|2C,4H,1O|2C,4H,1O|2H,3N)	[M+H]+	1
mzspec:GNPS:GNPS-LIBRARY:accession:CCMSLIB00009949377	CCMSLIB00009949377	0.84	5	Suspect related to Hexaethylene glycol (predicted molecular formula: C14H30O8) with delta m/z 44.026 (putative explanation: Ethanolation|Gly->Thr substitution|PEG repeat unit|unspecified; atomic difference: 2C,4H,1O|2C,4H,1O|2C,4H,1O|2H,3N)	[M+H]+	1
