USI	GNPSLibraryAccession	Cosine	Matching Peaks	CompoundName	Adduct	Charge
mzspec:GNPS:GNPS-LIBRARY:accession:CCMSLIB00009954190	CCMSLIB00009954190	0.76	6	Suspect related to Massbank:EQ331603 Linoleic acid|(9Z,12Z)-octadeca-9,12-dienoic acid (predicted molecular formula: C22H43NO2) with delta m/z 55.079 (putative explanation: unspecified; atomic difference: unspecified)	[M+H]+	1
mzspec:GNPS:GNPS-LIBRARY:accession:CCMSLIB00009965109	CCMSLIB00009965109	0.76	6	Suspect related to Methyl trans-vaccenate (predicted molecular formula: unknown) with delta m/z 71.073 (putative explanation: Cys alkylation by dimethylaminoethyl halide|Deoxyhypusine|Gly->Lys substitution|unspecified; atomic difference: 4C,9H,1N|4C,9H,1N|4C,9H,1N|4C,9H,1N)	[M-CH4O+H]+	1
mzspec:GNPS:GNPS-LIBRARY:accession:CCMSLIB00010004108	CCMSLIB00010004108	0.76	6	Suspect related to cis-13-Docosenoic acid (predicted molecular formula: C22H43NO2) with delta m/z 15.011 (putative explanation: ADP-ribosylation followed by conversion to hydroxamic acid via hydroxylamine|Leu/Ile->Lys substitution|Tyrosine oxidation to 2-aminotyrosine|unspecified; atomic difference: 1H,1N|1H,1N|1H,1N|1H,1N)	[M-H2O+H]+	1
mzspec:GNPS:GNPS-LIBRARY:accession:CCMSLIB00009929152	CCMSLIB00009929152	0.74	5	Suspect related to 1-Oleoyl-2-palmitoyl-rac-glycerol (predicted molecular formula: unknown) with delta m/z -2.964 (putative explanation: unspecified; atomic difference: unspecified)	[M-C16H32O2+H]+	1
mzspec:GNPS:GNPS-LIBRARY:accession:CCMSLIB00009977448	CCMSLIB00009977448	0.74	5	Suspect related to Oleamide (predicted molecular formula: unknown) with delta m/z 71.073 (putative explanation: Cys alkylation by dimethylaminoethyl halide|Deoxyhypusine|Gly->Lys substitution|unspecified; atomic difference: 4C,9H,1N|4C,9H,1N|4C,9H,1N|4C,9H,1N)	[M-NH3+H]+	1
