USI	GNPSLibraryAccession	Cosine	Matching Peaks	CompoundName	Adduct	Charge
mzspec:GNPS:GNPS-LIBRARY:accession:CCMSLIB00009977356	CCMSLIB00009977356	0.94	7	Suspect related to Octapropylene glycol (predicted molecular formula: C31H61N5O7) with delta m/z 133.111 (putative explanation: unspecified; atomic difference: unspecified)	[M+H]+	1
mzspec:GNPS:GNPS-LIBRARY:accession:CCMSLIB00009993760	CCMSLIB00009993760	0.94	7	Suspect related to Spectral Match to Heptapropylene glycol from NIST14 (predicted molecular formula: C31H61N5O7) with delta m/z 191.151 (putative explanation: unspecified; atomic difference: unspecified)	[M+H]+	1
mzspec:GNPS:GNPS-LIBRARY:accession:CCMSLIB00009949132	CCMSLIB00009949132	0.93	6	Suspect related to Heptapropylene glycol (predicted molecular formula: C30H62O11) with delta m/z 191.151 (putative explanation: unspecified; atomic difference: unspecified)	[M+H]+	1
mzspec:GNPS:GNPS-LIBRARY:accession:CCMSLIB00009996983	CCMSLIB00009996983	0.92	6	Suspect related to Spectral Match to Nonapropylene glycol from NIST14 (predicted molecular formula: C36H61N3O5) with delta m/z 75.069 (putative explanation: unspecified|unspecified; atomic difference: 1C,7H,4N|3C,9H,1N,1O)	[M+H]+	1
mzspec:GNPS:GNPS-LIBRARY:accession:CCMSLIB00009992332	CCMSLIB00009992332	0.91	6	Suspect related to Spectral Match to Decapropylene glycol from NIST14 (predicted molecular formula: C36H61N3O5) with delta m/z 17.027 (putative explanation: replacement of proton with ammonium ion; atomic difference: 3H,1N)	[M+H]+	1
mzspec:GNPS:GNPS-LIBRARY:accession:CCMSLIB00009977200	CCMSLIB00009977200	0.89	5	Suspect related to Nonapropylene glycol (predicted molecular formula: C36H61N3O5) with delta m/z 75.069 (putative explanation: unspecified|unspecified; atomic difference: 1C,7H,4N|3C,9H,1N,1O)	[M+H]+	1
