USI	GNPSLibraryAccession	Cosine	Matching Peaks	CompoundName	Adduct	Charge
mzspec:GNPS:GNPS-LIBRARY:accession:CCMSLIB00005436263	CCMSLIB00005436263	0.87	12	Contaminants septum vial Thermo C4000-53 and C4000-54 serie	M+H	1
mzspec:GNPS:GNPS-LIBRARY:accession:CCMSLIB00009992003	CCMSLIB00009992003	0.8	9	Suspect related to Spectral Match to Cyclopentasiloxane, decamethyl- from NIST14 (predicted molecular formula: C21H39NO15S2) with delta m/z 239.082 (putative explanation: unspecified; atomic difference: unspecified)	[M+H]+	1
mzspec:GNPS:GNPS-LIBRARY:accession:CCMSLIB00009944927	CCMSLIB00009944927	0.79	10	Suspect related to Contaminants septum vial Thermo C4000-53 and C4000-54 serie (predicted molecular formula: C20H35NO20) with delta m/z -148.038 (putative explanation: glycosyl-L-hydroxyproline (reverse); atomic difference: -5C,-8H,-5O)	[M+H]+	1
mzspec:GNPS:GNPS-LIBRARY:accession:CCMSLIB00009980008	CCMSLIB00009980008	0.76	9	Suspect related to Polyporic acid (predicted molecular formula: unknown) with delta m/z -15.995 (putative explanation: Ser->Ala substitution|Tyr->Phe substitution|reduction; atomic difference: -1O|-1O|-1O)	[2M+CH3CN+H]+	1
mzspec:GNPS:GNPS-LIBRARY:accession:CCMSLIB00009944830	CCMSLIB00009944830	0.74	9	Suspect related to Contaminant vial septum ThermoFisher C5000-44B (predicted molecular formula: unknown) with delta m/z -166.049 (putative explanation: N-(4-methoxy-6-methyl-1,3,5-triazin-2-yl)formamide loss; atomic difference: -6C,-6H,-4N,-2O)	[M+NH4]+	1
