USI	GNPSLibraryAccession	Cosine	Matching Peaks	CompoundName	Adduct	Charge
mzspec:GNPS:GNPS-LIBRARY:accession:CCMSLIB00009932939	CCMSLIB00009932939	0.88	9	Suspect related to 19-Hydroxycholesterol (predicted molecular formula: C28H46O) with delta m/z -3.995 (putative explanation: Pyro-Glu from E + Methylation|Thr->Pro substitution; atomic difference: 1C,-1O|1C,-1O)	[M-H2O+H]+	1
mzspec:GNPS:GNPS-LIBRARY:accession:CCMSLIB00009991558	CCMSLIB00009991558	0.85	7	Suspect related to Spectral Match to Cholic acid from NIST14 (predicted molecular formula: unknown) with delta m/z 26.089 (putative explanation: unspecified; atomic difference: unspecified)	[M-3H2O+H]+	1
mzspec:GNPS:GNPS-LIBRARY:accession:CCMSLIB00009937754	CCMSLIB00009937754	0.81	8	Suspect related to 4.beta.-Hydroxycholesterol 4-acetate (predicted molecular formula: unknown) with delta m/z 14.016 (putative explanation: Asn->Gln substitution|Asp->Glu substitution|Gly->Ala substitution|Methylation|Ser->Thr substitution|Val->Leu/Ile substitution|chain elongation; atomic difference: 1C,2H|1C,2H|1C,2H|1C,2H|1C,2H|1C,2H|1C,2H)	[M-C2H6O3+H]+	1
mzspec:GNPS:GNPS-LIBRARY:accession:CCMSLIB00009926625	CCMSLIB00009926625	0.77	8	Suspect related to .beta.-Sitosterol (predicted molecular formula: C25H50OS) with delta m/z -16.031 (putative explanation: Leu/Ile->Pro substitution; atomic difference: -1C,-4H)	[M-H2O+H]+	1
mzspec:GNPS:GNPS-LIBRARY:accession:CCMSLIB00009944170	CCMSLIB00009944170	0.72	8	Suspect related to Cholesta-5,7-dien-3-ol, (3.beta.)- (predicted molecular formula: unknown) with delta m/z -3.995 (putative explanation: Pyro-Glu from E + Methylation|Thr->Pro substitution; atomic difference: 1C,-1O|1C,-1O)	[M+H]+	1
mzspec:GNPS:GNPS-LIBRARY:accession:CCMSLIB00009942706	CCMSLIB00009942706	0.7	7	Suspect related to B10A30 Faulkner legacy library looks like sterol or lipid needs to be verified (predicted molecular formula: C28H44) with delta m/z -14.016 (putative explanation: Ala->Gly substitution|Gln->Asn substitution|Glu->Asp substitution|Leu/Ile->Val substitution|Thr->Ser substitution; atomic difference: -1C,-2H|-1C,-2H|-1C,-2H|-1C,-2H|-1C,-2H)	[M+H]+	1
