USI	GNPSLibraryAccession	Cosine	Matching Peaks	CompoundName	Adduct	Charge
mzspec:GNPS:GNPS-LIBRARY:accession:CCMSLIB00009937165	CCMSLIB00009937165	0.92	10	Suspect related to 3.alpha.-Hydroxy-7-oxo-5.beta.-cholanic acid (predicted molecular formula: C29H50O2) with delta m/z 40.104 (putative explanation: unspecified; atomic difference: unspecified)	[M-2H2O+H]+	1
mzspec:GNPS:GNPS-LIBRARY:accession:CCMSLIB00009944132	CCMSLIB00009944132	0.88	10	Suspect related to Cholecalciferol (predicted molecular formula: unknown) with delta m/z 28.031 (putative explanation: Acetaldehyde +28|Ala->Val substitution|Cys->Met substitution|Ethylation|di-Methylation; atomic difference: 2C,4H|2C,4H|2C,4H|2C,4H|2C,4H)	[M-H2O+H]+	1
mzspec:GNPS:GNPS-LIBRARY:accession:CCMSLIB00009939822	CCMSLIB00009939822	0.86	10	Suspect related to 8(9)-Dehydrocholesterol (predicted molecular formula: C28H44O2) with delta m/z 27.995 (putative explanation: Formylation|Ser->Asp substitution|Thr->Glu substitution; atomic difference: 1C,1O|1C,1O|1C,1O)	[M-H2O+H]+	1
mzspec:GNPS:GNPS-LIBRARY:accession:CCMSLIB00009944501	CCMSLIB00009944501	0.8	8	Suspect related to Cholic acid (predicted molecular formula: C29H52O3) with delta m/z 40.104 (putative explanation: unspecified; atomic difference: unspecified)	[M-3H2O+H]+	1
mzspec:GNPS:GNPS-LIBRARY:accession:CCMSLIB00009943432	CCMSLIB00009943432	0.74	8	Suspect related to Brassicasterol (predicted molecular formula: C23H48N4O2) with delta m/z 14.016 (putative explanation: Asn->Gln substitution|Asp->Glu substitution|Gly->Ala substitution|Methylation|Ser->Thr substitution|Val->Leu/Ile substitution|chain elongation; atomic difference: 1C,2H|1C,2H|1C,2H|1C,2H|1C,2H|1C,2H|1C,2H)	[M-H2O+H]+	1
mzspec:GNPS:GNPS-LIBRARY:accession:CCMSLIB00009926640	CCMSLIB00009926640	0.73	8	Suspect related to .beta.-Sitosterol (predicted molecular formula: C29H48O) with delta m/z -2.016 (putative explanation: 2-amino-3-oxo-butanoic_acid|Intact disulfide bridge|Val->Pro substitution; atomic difference: -2H|-2H|-2H)	[M-H2O+H]+	1
mzspec:GNPS:GNPS-LIBRARY:accession:CCMSLIB00009991269	CCMSLIB00009991269	0.73	8	Suspect related to Spectral Match to Cholestan-3-one, (5.alpha.)- from NIST14 (predicted molecular formula: unknown) with delta m/z 26.016 (putative explanation: Acetaldehyde +26|Ala->Pro substitution|unspecified; atomic difference: 2C,2H|2C,2H|2C,2H)	[M-H2O+H]+	1
mzspec:GNPS:GNPS-LIBRARY:accession:CCMSLIB00009991571	CCMSLIB00009991571	0.71	7	Suspect related to Spectral Match to Cholic acid from NIST14 (predicted molecular formula: unknown) with delta m/z 40.104 (putative explanation: unspecified; atomic difference: unspecified)	[M-3H2O+H]+	1
mzspec:GNPS:GNPS-LIBRARY:accession:CCMSLIB00009944175	CCMSLIB00009944175	0.7	8	Suspect related to Cholesta-5,7-dien-3-ol, (3.beta.)- (predicted molecular formula: unknown) with delta m/z 10.021 (putative explanation: Ser->Pro substitution; atomic difference: 2C,2H,-1O)	[M+H]+	1
