USI	GNPSLibraryAccession	Cosine	Matching Peaks	CompoundName	Adduct	Charge
mzspec:GNPS:GNPS-LIBRARY:accession:CCMSLIB00009938161	CCMSLIB00009938161	0.8	7	Suspect related to 5-Heptenoic acid, 7-[(1S,2S,3S,5R)-3-[[(4-iodophenyl)sulfonyl]amino]-6,6-dimethylbicyclo[3.1.1]hept-2-yl]-, (5Z)- (predicted molecular formula: unknown) with delta m/z 98.036 (putative explanation: unspecified; atomic difference: unspecified)	[M-C6H6INO2S+H]+	1
mzspec:GNPS:GNPS-LIBRARY:accession:CCMSLIB00009965507	CCMSLIB00009965507	0.76	5	Suspect related to Monolinolenin (9c,12c,15c) (predicted molecular formula: C23H38O2) with delta m/z 12.036 (putative explanation: Ser->Val substitution|Thr->Leu/Ile substitution; atomic difference: 2C,4H,-1O|2C,4H,-1O)	[M-H2O+H]+	1
mzspec:GNPS:GNPS-LIBRARY:accession:CCMSLIB00009995867	CCMSLIB00009995867	0.76	5	Suspect related to Spectral Match to Monolinolenin (9c,12c,15c) from NIST14 (predicted molecular formula: C23H38O2) with delta m/z -5.974 (putative explanation: unspecified; atomic difference: unspecified)	[M+H]+	1
mzspec:GNPS:GNPS-LIBRARY:accession:CCMSLIB00009950181	CCMSLIB00009950181	0.74	5	Suspect related to Kirenol (predicted molecular formula: C18H38N2O4) with delta m/z 26.053 (putative explanation: Ser->Leu/Ile substitution; atomic difference: 3C,6H,-1O)	[M-H2O+H]+	1
mzspec:GNPS:GNPS-LIBRARY:accession:CCMSLIB00009980315	CCMSLIB00009980315	0.74	5	Suspect related to Prostaglandin F1.alpha. alcohol (predicted molecular formula: C18H38N2O4) with delta m/z 22.02 (putative explanation: unspecified; atomic difference: unspecified)	[M-H2O+H]+	1
mzspec:GNPS:GNPS-LIBRARY:accession:CCMSLIB00009998116	CCMSLIB00009998116	0.74	5	Suspect related to Spectral Match to Pinolenic acid from NIST14 (predicted molecular formula: C18H38N2O4) with delta m/z 68.063 (putative explanation: Piperidination|unspecified; atomic difference: 5C,8H|5C,8H)	[M+H]+	1
mzspec:GNPS:GNPS-LIBRARY:accession:CCMSLIB00009973068	CCMSLIB00009973068	0.71	6	Suspect related to NCGC00381425-01!8-hydroxy-8-(3-octyloxiran-2-yl)octanoic acid (predicted molecular formula: C6H29N14O2) with delta m/z 32.037 (putative explanation: unspecified; atomic difference: 4H,2N)	[M+H]+	1
