USI	GNPSLibraryAccession	Cosine	Matching Peaks	CompoundName	Adduct	Charge
mzspec:GNPS:GNPS-LIBRARY:accession:CCMSLIB00009965361	CCMSLIB00009965361	0.8	6	Suspect related to Monolaurin (predicted molecular formula: C14H28O4) with delta m/z -14.016 (putative explanation: Ala->Gly substitution|Gln->Asn substitution|Glu->Asp substitution|Leu/Ile->Val substitution|Thr->Ser substitution; atomic difference: -1C,-2H|-1C,-2H|-1C,-2H|-1C,-2H|-1C,-2H)	[M-H2O+H]+	1
mzspec:GNPS:GNPS-LIBRARY:accession:CCMSLIB00009930421	CCMSLIB00009930421	0.76	6	Suspect related to 1-Stearoyl-rac-glycerol (predicted molecular formula: C14H28O4) with delta m/z -98.108 (putative explanation: unspecified; atomic difference: unspecified)	[M-H2O+H]+	1
mzspec:GNPS:GNPS-LIBRARY:accession:CCMSLIB00009964930	CCMSLIB00009964930	0.74	6	Suspect related to Methyl palmitoleate (predicted molecular formula: C14H26OS) with delta m/z -26.063 (putative explanation: unspecified; atomic difference: unspecified)	[M+H]+	1
mzspec:GNPS:GNPS-LIBRARY:accession:CCMSLIB00009993060	CCMSLIB00009993060	0.74	6	Suspect related to Spectral Match to Elaidic acid from NIST14 (predicted molecular formula: unknown) with delta m/z -40.032 (putative explanation: Descyclopropyl, dealkenation|Pro->Gly substitution; atomic difference: -3C,-4H|-3C,-4H)	[M+H]+	1
mzspec:GNPS:GNPS-LIBRARY:accession:CCMSLIB00009985465	CCMSLIB00009985465	0.74	5	Suspect related to Spectral Match to 1-Hexadecanoyl-sn-glycerol from NIST14 (predicted molecular formula: unknown) with delta m/z -88.088 (putative explanation: unspecified; atomic difference: unspecified)	[M+H]+	1
